5,Kabarnet,Kabarnet mosop,Seguton,,Ketindui,,,,,Yes ,PB,0.0,Ketindui ECDE,The construction was built to serve the children of ketindui village,"Education, Sports, Culture and Social services",ECDE centre,Completed,Excellent,The construction serves the ecde children of ketindui community,http://kc.humanitarianresponse.info/attachment/orginal?media_file=mapkibera/attachments/1532069371589.jpg,26240429,
5,Kabarnet,Kabarnet mosop,Seguton,,Ketindui,,,,,Yes ,PB,1429.0,Ketindui cattle dip,The wall of the cattle dip and tank was repaired,"Agriculture, Livestock and Fisheries",Other,Completed,Excellent,The cattle dip serves the locals of ketindui,http://kc.humanitarianresponse.info/attachment/orginal?media_file=mapkibera/attachments/1532070210322.jpg,26240441,
5,Kabarnet,Kabarnet mosop,Seguton,,Ketindui,,,,,Yes ,PB,2124.0,Ketindui footbridge,Contruction of garbions to support the footbridge,"Transport, Public Works and Infrasctructure",Road,Completed,Excellent,The footbridge serves the locals of of ketindui and mosho village,http://kc.humanitarianresponse.info/attachment/orginal?media_file=mapkibera/attachments/1532070720410.jpg,26240452,
5,Kabarnet,Kabarnet mosop,Seguton,,Ketindui,,,,,Yes ,PB,0.0,Kiplewel-sosion water project,Construction of the wall and piping to the residents of ketindui and kabarnet soi location atlarge,Water and Irrigation,Water project,Completed,Excellent,"The project serves the locals of ketindui,magonai and salawa residents",http://kc.humanitarianresponse.info/attachment/orginal?media_file=mapkibera/attachments/1532071537248.jpg,26240466,
5,Kabarnet,Kabarnet soi,,Salawa,Magonoi,,,,,Yes ,PB,4753.0,Magonoi borehole,The construction has not started,Water and Irrigation,Borehole,Not yet started,Poor,The borehole does not serve the residents of magonoi because it is not yet started,http://kc.humanitarianresponse.info/attachment/orginal?media_file=mapkibera/attachments/1532074062854.jpg,26240500,
5,Kabarnet,Kabarnet soi,,Salawa,Magonoi,,,,,Yes ,HQ,3552.0,Magonoi Dispensary-fencing,Construction of dispensary building,Health Services,Dispensary,Completed,Excellent,The fencing provide security to the dispensary,http://kc.humanitarianresponse.info/attachment/orginal?media_file=mapkibera/attachments/1532081081315.jpg,26240541,
1,Kabarnet,Kabarnet mosop,Kewamoi,,Kiberenge village,,,,,Yes ,HQ,0.0,Kiberenge water project,Construction of storage tank and water kiosk,Water and Irrigation,Water project,Completed,Adequate,The project is in good condition but only paints need to be applied.,http://kc.humanitarianresponse.info/attachment/orginal?media_file=mapkibera/attachments/1532083880503.jpg,26240846,
2,Kabarnet,Kabarnet mosop,Seguton,,kator,,,,,Yes ,HQ,4737.0,Kator-Emgos water project,kator emgos water project,Water and Irrigation,Water project,In progress,Adequate,the project is incomplete.,http://kc.humanitarianresponse.info/attachment/orginal?media_file=mapkibera/attachments/1532069424560.jpg,26247248,
2,Kabarnet,Kabarnet mosop,Seguton,,seguton,,,,,Yes ,HQ,0.0,Seguton Hill Primary School,,"Education, Sports, Culture and Social services",Other,Completed,Adequate,construction if seguton pry school,http://kc.humanitarianresponse.info/attachment/orginal?media_file=mapkibera/attachments/1532072336422.jpg,26247289,
2,Kabarnet,Kabarnet mosop,Kewamoi,,lelian,,,,,Yes ,HQ,3733.0,Lelian-Kapchepsir road,concrete works from lelian to kapchepsir road,"Transport, Public Works and Infrasctructure",Other,Completed,Adequate,the project is complete.,http://kc.humanitarianresponse.info/attachment/orginal?media_file=mapkibera/attachments/1532074875329.jpg,26247315,
2,Kabarnet,Kabarnet mosop,Kewamoi,,serei,,,,,Yes ,PB,5205.0,Policeline-Serei water piping,piping of policeline serei,Water and Irrigation,Other,In progress,Adequate,the project is incomplete.,http://kc.humanitarianresponse.info/attachment/orginal?media_file=mapkibera/attachments/1532076136460.jpg,26247321,
2,Kabarnet,Kabarnet mosop,Kewamoi,,kuriondonin,,,,,Yes ,HQ,5164.0,Kuriondonin footbridge,kuriondoni footbridge,"Lands, Housing and Urban Development",Other,Not yet started,Poor,it has not yet started,http://kc.humanitarianresponse.info/attachment/orginal?media_file=mapkibera/attachments/1532082875712.jpg,26247323,
2,Kabarnet,Kabarnet mosop,Kewamoi,,kaprogonya,,,,,Yes ,HQ,1668.0,Kaprogonya nature trail,"kaprogonya nature trail,viewpont,caves/campsite.","Environment, Natural Resource, Tourism and Wildlife Management",Other,In progress,Poor,the project has alot of bushes and the pathways are not managed.,http://kc.humanitarianresponse.info/attachment/orginal?media_file=mapkibera/attachments/1532084700586.jpg,26247332,
2,Kabarnet,Kabarnet mosop,Kewamoi,,Kaprogonya,,,,,Yes ,HQ,5154.0,Kaprogonya floodlights,flood lights at kaprogonya.,"Lands, Housing and Urban Development",Other,Completed,Adequate,one of the lights is not working,http://kc.humanitarianresponse.info/attachment/orginal?media_file=mapkibera/attachments/1532090142339.jpg,26247345,
2,Kabarnet,Kabarnet mosop,Kewamoi,,bondeni,,,,,Yes ,PB,2279.0,Hurth-bondeni-seguton road,construction of hurth-bondeni-seguton road,"Transport, Public Works and Infrasctructure",Road,Completed,Adequate,Drainage system required.,http://kc.humanitarianresponse.info/attachment/orginal?media_file=mapkibera/attachments/1532091048647.jpg,26247461,
2,Kabarnet,Kabarnet mosop,Kewamoi,,mumol,,,,,Yes ,HQ,3699.0,County of Baringo Housing Project-fencing,Proposed Construction of Fence on Proposed Housing Land.,"Lands, Housing and Urban Development",Other,In progress,Adequate,The gates are not in good condition. The costruction of the  fence has not been completed.,http://kc.humanitarianresponse.info/attachment/orginal?media_file=mapkibera/attachments/1532088846642.jpg,26624174,
2,Kabarnet,Kabarnet mosop,Seguton,,Chepkesin,,,,,Yes ,PB,5204.0,Chepkesin water project pipeline extension,Chepkesin water project,Water and Irrigation,Water project,In progress,Adequate,The project still requiers more piping for adequate water coverage for the population,http://kc.humanitarianresponse.info/attachment/orginal?media_file=mapkibera/attachments/1532156615251.jpg,26624178,
2,Kabarnet,Kabarnet mosop,Seguton,,showground,,,,,Yes ,HQ,5416.0,Sunrise borehole,equiping of sunrise borehole,Water and Irrigation,Borehole,Not yet started,Adequate,the project has not yet started,http://kc.humanitarianresponse.info/attachment/orginal?media_file=mapkibera/attachments/1532155054542.jpg,26624184,
4,Ravine,,,,,Kabiyet,Benonin,,Benonin,Yes ,PB,8913.0,Kabiyet-Benonin-Sogonin water piping,Erection of kabiyet-Benonin-sogonin water tank,Water and Irrigation,Water project,Completed,Adequate,The tank needs repairs due to leakages,http://kc.humanitarianresponse.info/attachment/orginal?media_file=mapkibera/attachments/1532595323774.jpg,26661920,
4,Ravine,,,,,Kabiyet,Benonin,,Sinende,Yes ,PB,5944.0,Sinende cattle dip,The cattle dip is incomplete,"Agriculture, Livestock and Fisheries",Other,In progress,Adequate,It need to be completed for operation purpose,http://kc.humanitarianresponse.info/attachment/orginal?media_file=mapkibera/attachments/1532601416168.jpg,26662034,
4,Ravine,,,,,Kabiyet,Benonin,,Sosion,Yes ,PB,6037.0,Kaburandi(Sosion)Cattle Dip,Construction of Kaburandi( Sosion Cattle Dip),"Agriculture, Livestock and Fisheries",Other,Completed,Adequate,It requires maintainance,http://kc.humanitarianresponse.info/attachment/orginal?media_file=mapkibera/attachments/1532605875088.jpg,26662079,
2,Ravine,,,,,Ravine,,,Kapdeining,Yes ,HQ,8252.0,Eldama ravine stadium ,Construction and completion of eldama ravine stadium ,"Education, Sports, Culture and Social services",Sports ground,In progress,Adequate,Started but not yet completed ,http://kc.humanitarianresponse.info/attachment/orginal?media_file=mapkibera/attachments/1532596274336.jpg,26662858,
2,Ravine,,,,,Ravine,,,Kapdeining,Yes ,HQ,8332.0,Eco toilet,Eldama ravine stadium ,Health Services,Public_toilet,Completed,Excellent,Its serve the local of kapdeining and community at large ,http://kc.humanitarianresponse.info/attachment/orginal?media_file=mapkibera/attachments/1532596770104.jpg,26662882,
2,Ravine,,,,,Ravine,,,Kisarget,Yes ,PB,8656.0,Chemususu water project ,Chemususu water project ,Water and Irrigation,Water project,Completed,Adequate,Not enough  water for community  at large ,http://kc.humanitarianresponse.info/attachment/orginal?media_file=mapkibera/attachments/1532597436439.jpg,26662893,
2,Ravine,,,,,Ravine,,,Shauri,Yes ,HQ,9958.0,Eldama Ravine slaughter house -Septic tanks ,Eldama Ravine slaughter house ,"Agriculture, Livestock and Fisheries",Other,Completed,Adequate,Construction  of septic  tank  completed but its stich,http://kc.humanitarianresponse.info/attachment/orginal?media_file=mapkibera/attachments/1532598375724.jpg,26662913,
2,Ravine,,,,,Ravine,,,Kisarget,Yes ,PB,0.0,Kisarget dumping site,Very poor,"Agriculture, Livestock and Fisheries",Dumpsite,In progress,Poor,Very poor  need maintenance ,http://kc.humanitarianresponse.info/attachment/orginal?media_file=mapkibera/attachments/1532599170722.jpg,26663173,
2,Ravine,,,,,Ravine,,,Bondeni ,Yes ,PB,8585.0,Bondeni water kiosk project,Not satisfactory not enough  water ,Water and Irrigation,Water project,In progress,Adequate,Not satisfactory need renovation ,http://kc.humanitarianresponse.info/attachment/orginal?media_file=mapkibera/attachments/1532602925860.jpg,26663236,
2,Ravine,,,,,Ravine,,,Bondeni nursery school ,Yes ,PB,5820.0,Bondeni nursery school ,Not yet finished ,"Education, Sports, Culture and Social services",ECDE centre,In progress,Adequate,Not yet completed ,http://kc.humanitarianresponse.info/attachment/orginal?media_file=mapkibera/attachments/1532603700659.jpg,26663240,
2,Ravine,,,,,Ravine,,,Bondeni,Yes ,PB,0.0,Water kiosk,Water kiosk ,Water and Irrigation,Water project,Completed,Adequate,Not in good condition inadequate water ,http://kc.humanitarianresponse.info/attachment/orginal?media_file=mapkibera/attachments/1532603916564.jpg,26663249,
2,Ravine,,,,,Ravine,,,Ravine,Yes ,HQ,9928.0,Eldama Ravine Sub-County Referral Hospital-laundry block,Construction Kitchen laundry block ,Health Services,Hospital,In progress,Adequate,Construction In progress ,http://kc.humanitarianresponse.info/attachment/orginal?media_file=mapkibera/attachments/1532606491571.jpg,26663306,
2,Ravine,,,,,Ravine,,,Ravine ,Yes ,HQ,9952.0,Eldama Ravine Sub-County Referral Hospital-Hospital kitchen ,In progress ,Health Services,Hospital,Not yet started,Adequate,Need renovation ,http://kc.humanitarianresponse.info/attachment/orginal?media_file=mapkibera/attachments/1532606762137.jpg,26663312,
2,Ravine,,,,,Ravine,,,Ravine,Yes ,HQ,8051.0,Eldama Ravine Sub-County Referral Hospital-Mortuary equipment,Wall,Health Services,Hospital,Completed,Excellent,In good condition ,http://kc.humanitarianresponse.info/attachment/orginal?media_file=mapkibera/attachments/1532607352984.jpg,26663338,
2,Ravine,,,,,Ravine,,,Ravine ,Yes ,HQ,7995.0,Eldama Ravine Sub-County Referral Hospital-Perimeter wall ,None,Health Services,Hospital,Completed,Excellent,In good condition ,http://kc.humanitarianresponse.info/attachment/orginal?media_file=mapkibera/attachments/1532607515814.jpg,26663342,
2,Ravine,,,,,Ravine,,,Ravine ,Yes ,HQ,8014.0,Eldama Ravine Sub-County Referral Hospital-wards walkway,Walkbway,Health Services,Health center,Completed,Excellent,In good condition ,http://kc.humanitarianresponse.info/attachment/orginal?media_file=mapkibera/attachments/1532607913062.jpg,26663361,
2,Ravine,,,,,Ravine,,,Ravine,Yes ,HQ,8066.0,Garden square-toilet,Public toilet,"Education, Sports, Culture and Social services",Other,Completed,Excellent,It serve people of eldama ravine town,http://kc.humanitarianresponse.info/attachment/orginal?media_file=mapkibera/attachments/1532610379185.jpg,26663654,
2,Ravine,,,,,Ravine,,,Ravine ,Yes ,HQ,8014.0,Eldama Ravine Sub-County Referral Hospital-Power Generator,Construction of generator,Health Services,Health center,Completed,Excellent,Good condition ,http://kc.humanitarianresponse.info/attachment/orginal?media_file=mapkibera/attachments/1532607098117.jpg,26663837,
2,Ravine,,,,,Ravine,,,Ravine,Yes ,HQ,0.0,Eldama Ravine Sub-County Referral Hospital-Power Generator-Opd block,Pavement wall,Health Services,Hospital,In progress,Adequate,It is not yet used construction in progress ,http://kc.humanitarianresponse.info/attachment/orginal?media_file=mapkibera/attachments/1532608196635.jpg,26663862,
3,Ravine,,,,,Kabiyet,Kabiyet,,Luita,Yes ,PB,0.0,Luita ECDE,Construction of ECDE classrooms,"Education, Sports, Culture and Social services",ECDE centre,In progress,Poor,1. The classroom floors are already damaged due to poor construction. 2. The project is stalling. 3. There are no toilets for the pupils.,http://kc.humanitarianresponse.info/attachment/orginal?media_file=mapkibera/attachments/1231043242009.jpg,26664063,
3,Ravine,,,,,Kabiyet,Kabiyet,,Kabiyet,Yes ,PB,6023.0,Kabiyet Cattle Dip,Renovation of Kabiyet cattle dip,"Agriculture, Livestock and Fisheries",Other,Completed,Adequate,"1. The cattle dip assists the local people to treat their livestock. 2. The storage tank however, is leaking due poor construction",http://kc.humanitarianresponse.info/attachment/orginal?media_file=mapkibera/attachments/1231044684660.jpg,26664086,
3,Ravine,,,,,Kabiyet,Kabiyet,,Kabiyet,Yes ,HQ,0.0,Uhuru High School-Kabiyet,"Construction of Adminstration Block, offices and classrooms","Education, Sports, Culture and Social services",Other,In progress,Excellent,1.Good workmanship. 2.worked in good time,http://kc.humanitarianresponse.info/attachment/orginal?media_file=mapkibera/attachments/1231052002481.jpg,26664152,
3,Ravine,,,,,Kabiyet,Kabiyet,,Kabiyet,Yes ,HQ,0.0,Uhuru High School-laboratory,Use for science practicals,"Education, Sports, Culture and Social services",Other,Completed,Adequate,1.poor drainage. 2.No gas system. 3.broken taps. 4.No sits. 5.inadequate fume chamber,http://kc.humanitarianresponse.info/attachment/orginal?media_file=mapkibera/attachments/1231052689752.jpg,26664159,
3,Ravine,,,,,Kabiyet,Kabiyet,,Kabiyet,Yes ,HQ,0.0,Kabiyet ECDE,,"Education, Sports, Culture and Social services",ECDE centre,Completed,Adequate,1.incomplete erection of drawers. 2.No facilitation of playing kits. 3Need more space of classes.  4.Inadequate teachers. 5.cracking walls. 6 No ECDE toilets,http://kc.humanitarianresponse.info/attachment/orginal?media_file=mapkibera/attachments/1231053714486.jpg,26664170,
1,Ravine,,,,,Ravine,,,Kamelilo,Yes ,PB,0.0,Kamelilo Vocational Training Center,Contruction of administration block and classroom,"Education, Sports, Culture and Social services",Other,Completed,Excellent,The polytecnic is well build also well equiped,http://kc.humanitarianresponse.info/attachment/orginal?media_file=mapkibera/attachments/1532596227472.jpg,26669236,
1,Ravine,,,,,Ravine,,,Kamelilo,Yes ,PB,5598.0,Kamelilo ECDE,Erection and completion of ecde classrooms,"Education, Sports, Culture and Social services",ECDE centre,In progress,Poor,The classrooms have stayed for more than three years still under construction (incomplete classrooms),http://kc.humanitarianresponse.info/attachment/orginal?media_file=mapkibera/attachments/1532598196976.jpg,26669272,
1,Ravine,,,,,Ravine,,,Kamelilo,Yes ,PB,0.0,Kamelilo Secondary School-dining hall,Multi-purpose dinning hall,"Education, Sports, Culture and Social services",Social hall,In progress,Excellent,Well built,http://kc.humanitarianresponse.info/attachment/orginal?media_file=mapkibera/attachments/1532615141122.jpg,26669317,
2,Ravine,,,,,Ravine,,Ravine,Kapdening,Yes ,PB,9998.0,Eldama Ravine Stadiume-rehabilitation of running track and football pitch and fencing,"Rehabilitation of the running track,football pitch and fencing","Education, Sports, Culture and Social services",Sports ground,Completed,Adequate,Needs renovations,http://kc.humanitarianresponse.info/attachment/orginal?media_file=mapkibera/attachments/1532674503455.jpg,26727827,
3,Ravine,,,,,Kabiyet,Kabiyet,,Tabare,Yes ,PB,5794.0,Tabare ECDE classroom,Construction of new classroom,"Education, Sports, Culture and Social services",ECDE centre,In progress,Adequate,"1.Project has stopped for four years. 2.poor workmanship. 3.New project has overcomed old project. 4.The building is small,congestion of pupils.",http://kc.humanitarianresponse.info/attachment/orginal?media_file=mapkibera/attachments/1532682710793.jpg,26728281,
3,Ravine,,,,,Kabiyet,Kabiyet,,Sogonin,Yes ,HQ,0.0,Sogonin ECDE,Construction of ECDE classrooms,"Education, Sports, Culture and Social services",ECDE centre,In progress,Poor,1.poor erection of pillars. 2.No fisherboards. 3 Cracking of walls and floors. 4 Congestion of pupils. 5.Poor location and texture of chalkboard. 6. Inadequate chairs and tables.,http://kc.humanitarianresponse.info/attachment/orginal?media_file=mapkibera/attachments/1532687436967.jpg,26728319,
2,Ravine,,,,,Ravine,,Ravine,Ravine,Yes ,PB,9980.0,Shimoni  ECDE,Construction of an ECDE classroom block,"Education, Sports, Culture and Social services",ECDE centre,In progress,Adequate,Part of the classroom block is complete but the windows need repairs.,http://kc.humanitarianresponse.info/attachment/orginal?media_file=mapkibera/attachments/1532680805309.jpg,26728748,
1,Ravine,,,,,Ravine,,Ravine,Kamelilo,Yes ,PB,8626.0,Chemususu Project Offices,Construction offices ,Water and Irrigation,Water project,In progress,Excellent,There are adequate and quality materials and labour for construction,http://kc.humanitarianresponse.info/attachment/orginal?media_file=mapkibera/attachments/1532674422068.jpg,26732864,
1,Ravine,,,,,Ravine,,Ravine,Milimani ,Yes ,PB,0.0,ECDE Construction project,,"Education, Sports, Culture and Social services",ECDE centre,In progress,Poor,The construction is incomplete due to lack of enough  materials,http://kc.humanitarianresponse.info/attachment/orginal?media_file=mapkibera/attachments/1532686350800.jpg,26733025,
2,Ravine,,,,,Ravine,,Ravine,Ravine,Yes ,PB,8656.0,Chemususu water project ,In good condition serving the community ,Water and Irrigation,Water project,Completed,Adequate,It's serve the community at large ,http://kc.humanitarianresponse.info/attachment/orginal?media_file=mapkibera/attachments/1532938060932.jpg,26921344,
2,Ravine,,,,,Ravine,,Ravine,Ravine ,Yes ,HQ,8079.0,Stage Water bowser,Main stage ,Water and Irrigation,Water project,Completed,Poor,Bowser need renovation ,http://kc.humanitarianresponse.info/attachment/orginal?media_file=mapkibera/attachments/1532939572754.jpg,26922141,
2,Ravine,,,,,Ravine,,Ravine,Ravine ,Yes ,PB,9988.0,Main stage car wash,Car wash ,"Transport, Public Works and Infrasctructure",Parking space,Completed,Excellent,In good condition serving the community at large ,http://kc.humanitarianresponse.info/attachment/orginal?media_file=mapkibera/attachments/1532938560980.jpg,26922849,
2,Ravine,,,,,Ravine,,Ravine,Ravine,Yes ,HQ,6303.0,Ravine market-renovation,Proposed renovation and civil works at ravine market,"Transport, Public Works and Infrasctructure",Market stall,Completed,Adequate,Its need to be revanished not in good condition,http://kc.humanitarianresponse.info/attachment/orginal?media_file=mapkibera/attachments/1533124583285.jpg,27061423,
2,Ravine,,,,,Ravine,,Ravine,Ravine,Yes ,PB,9987.0,Elama Ravine drainage ,Improvement of project system,"Transport, Public Works and Infrasctructure",Other,Completed,Adequate,It is in good condition but required to be sealed,http://kc.humanitarianresponse.info/attachment/orginal?media_file=mapkibera/attachments/1533124935388.jpg,27061427,